{
  "patch_registry_version": "1.0.0",
  "feat_id": "example-feat",
  "patches": [
    {
      "id": "UXPATCH-0001",
      "status": "active",
      "change_class": "visual",
      "created_at": "2026-04-16T10:00:00Z",
      "title": "Fix primary button color contrast",
      "patch_file": "UXPATCH-0001__example-ux-patch.yaml"
    }
  ],
  "last_updated": "2026-04-16T10:00:00Z"
}
